<?xml version="1.0" encoding="UTF-8"?>
<!DOCTYPE real-estate SYSTEM "real-estate.dtd">
<real-estate>

    <agencies>
        <agency>
            <name>Sunrise Realty</name>
            <address>
                <street-number>Main Street 12</street-number>
                <state>Andalucía</state>
                <country>Spain</country>
                <postal-code>21001</postal-code>
            </address>
            <email>contact@sunrise.com</email>
            <phone>600123456</phone>
        </agency>
    </agencies>

    <owners>
        <owner id="OWN1">
            <name>John Doe</name>
            <address>
                <street-number>Oak Road 5</street-number>
                <state>Texas</state>
                <postal-code>73301</postal-code>
            </address>
        </owner>
    </owners>

    <properties>
        <property owner-ref="OWN1">
            <name>Greenwood Apartments</name>
            <address>
                <street-number>Hill Avenue 20</street-number>
                <state>Texas</state>
                <country>USA</country>
                <postal-code>73301</postal-code>
            </address>
            <description>
                Includes flats
                <flatReference flatName="FlatA">A</flatReference>
                and
                <flatReference flatName="FlatB">B</flatReference>.
            </description>
            <number-of-flats>2</number-of-flats>
            <features>Parking, Garden</features>
        </property>
    </properties>

    <flats>
        <flat property-ref="OWN1">
            <name>FlatA</name>
            <address>
                <street-number>Hill Avenue 20</street-number>
                <state>Texas</state>
                <postal-code>73301</postal-code>
            </address>
            <description>
                <details>
                    <rooms>2</rooms>
                    <size>75 m2</size>
                </details>
            </description>
            <features>Balcony</features>
        </flat>

        <flat property-ref="OWN1">
            <name>FlatB</name>
            <address>
                <street-number>Hill Avenue 20</street-number>
                <state>Texas</state>
                <postal-code>73301</postal-code>
            </address>
            <description>
                <info>
                    <type>Studio</type>
                    <size>40 m2</size>
                </info>
            </description>
            <features>Air conditioning</features>
        </flat>
    </flats>

</real-estate>
